{
  "schema": 1,
  "project": "marketbrain",
  "exported_at": "2026-10-23T06:00:00-04:00",
  "agents": [
    { "name": "MarketBrain nightly", "kind": "schedule", "status": "ok", "last_run": "2026-10-23T02:00:00-04:00",
      "next_run": "2026-10-24T02:00:00-04:00", "summary": "Bridges merged PRs, ingests new sources and runs lint.", "link": "" },
    { "name": "Portfolio briefing", "kind": "schedule", "status": "ok", "last_run": "2026-10-22T06:30:00-04:00",
      "next_run": "2026-10-23T06:30:00-04:00", "summary": "Builds the daily briefing PDF.", "link": "" },
    { "name": "ORB bot", "kind": "bot", "status": "ok", "last_run": "2026-10-22T09:45:00-04:00",
      "next_run": "2026-10-23T09:45:00-04:00", "summary": "Paper-trades the opening range breakout.", "link": "" },
    { "name": "review", "kind": "skill", "status": "idle", "last_run": "2026-10-22T20:10:00-04:00",
      "next_run": "", "summary": "Lucky decides on wiki proposals.", "link": "" }
  ],
  "queue": [
    { "kind": "proposal", "title": "Update strategies/orb with the October results", "age_days": 2, "urgency": "high",
      "action": { "label": "Review", "command": "claude \"/review\"" } },
    { "kind": "proposal", "title": "New lesson: wide opening ranges fail more often", "age_days": 1,
      "action": { "label": "Review", "command": "claude \"/review\"" } },
    { "kind": "pr", "title": "feat/hub-export has commits not merged into dev", "age_days": 0,
      "action": { "label": "Open session", "command": "claude" } }
  ],
  "health": { "lint_errors": 0, "lint_warnings": 3, "stale_pages": 2, "sources_unprocessed": 4 },
  "learning": [
    { "date": "2026-10-22", "kind": "lesson", "title": "Wide opening ranges fail more often",
      "citation": "[[lessons/wide-opening-ranges]]", "link": "obsidian://open?vault=Suhas&file=vault/wiki/lessons/wide-opening-ranges" }
  ],
  "suggestions": [
    { "rank": 1, "title": "Split the nightly report by stage", "why": "Failures are hard to place in one long log.", "source": "tune" }
  ],
  "metrics": [
    { "label": "ORB paper P&L (30d)", "value": "+1.8%", "trend": "up", "help": "Paper trading only." },
    { "label": "Pick hit rate", "value": "58%", "trend": "flat", "help": "Share of picks above entry after 20 days." }
  ],
  "links": [
    { "label": "Vault", "url": "obsidian://open?vault=Suhas" }
  ]
}
